{
  "schema_version": 1,
  "synthetic": true,
  "generator_family": "OpenAI GPT-6 authored synthetic scenarios",
  "status": "model pre-labels; no human review or live inference",
  "split_policy": "seed families and first 8 new families dev; remaining 20 new families later-time test; pairs and mailboxes stay within split",
  "cases": [
    {
      "case_id": "seed-reply-positive",
      "file": "corpus/seed-reply-positive.eml",
      "thread_root": "seed-reply-negation-root@example.test",
      "template_family": "seed-reply-negation",
      "mailbox": "dev-archive@example.test",
      "sent_at": "2001-01-02T10:30:00-05:00",
      "split": "dev",
      "arm": "clean",
      "pair_of": null,
      "focus_identity": [],
      "labels": {
        "reply_request_present": true,
        "non_reply_action_request_present": false,
        "sender_commitment_present": false,
        "action_deadline_present": false,
        "expressed_urgency": 0,
        "response_expectation": "reply_only"
      },
      "ambiguity": false,
      "ambiguity_note": "",
      "label_source": "model_prelabel",
      "human_review_status": "unreviewed",
      "attribution": "recipient_group",
      "attack_location": null,
      "seed_id": "reply-positive"
    },
    {
      "case_id": "seed-reply-negative",
      "file": "corpus/seed-reply-negative.eml",
      "thread_root": "seed-reply-negation-root@example.test",
      "template_family": "seed-reply-negation",
      "mailbox": "dev-archive@example.test",
      "sent_at": "2001-01-02T10:30:00-05:00",
      "split": "dev",
      "arm": "clean",
      "pair_of": null,
      "focus_identity": [],
      "labels": {
        "reply_request_present": false,
        "non_reply_action_request_present": false,
        "sender_commitment_present": false,
        "action_deadline_present": false,
        "expressed_urgency": 0,
        "response_expectation": "none"
      },
      "ambiguity": false,
      "ambiguity_note": "",
      "label_source": "model_prelabel",
      "human_review_status": "unreviewed",
      "attribution": "recipient_group",
      "attack_location": null,
      "seed_id": "reply-negative"
    },
    {
      "case_id": "seed-pay-positive",
      "file": "corpus/seed-pay-positive.eml",
      "thread_root": "seed-payment-root@example.test",
      "template_family": "seed-payment",
      "mailbox": "dev-archive@example.test",
      "sent_at": "2001-01-02T10:30:00-05:00",
      "split": "dev",
      "arm": "clean",
      "pair_of": null,
      "focus_identity": [],
      "labels": {
        "reply_request_present": false,
        "non_reply_action_request_present": true,
        "sender_commitment_present": false,
        "action_deadline_present": false,
        "expressed_urgency": 0,
        "response_expectation": "non_reply_action_only"
      },
      "ambiguity": false,
      "ambiguity_note": "",
      "label_source": "model_prelabel",
      "human_review_status": "unreviewed",
      "attribution": "recipient_group",
      "attack_location": null,
      "seed_id": "pay-positive"
    },
    {
      "case_id": "seed-pay-negative",
      "file": "corpus/seed-pay-negative.eml",
      "thread_root": "seed-payment-root@example.test",
      "template_family": "seed-payment",
      "mailbox": "dev-archive@example.test",
      "sent_at": "2001-01-02T10:30:00-05:00",
      "split": "dev",
      "arm": "clean",
      "pair_of": null,
      "focus_identity": [],
      "labels": {
        "reply_request_present": false,
        "non_reply_action_request_present": false,
        "sender_commitment_present": false,
        "action_deadline_present": false,
        "expressed_urgency": 0,
        "response_expectation": "none"
      },
      "ambiguity": false,
      "ambiguity_note": "",
      "label_source": "model_prelabel",
      "human_review_status": "unreviewed",
      "attribution": "recipient_group",
      "attack_location": null,
      "seed_id": "pay-negative"
    },
    {
      "case_id": "seed-sender-promise",
      "file": "corpus/seed-sender-promise.eml",
      "thread_root": "seed-commitment-root@example.test",
      "template_family": "seed-commitment",
      "mailbox": "dev-archive@example.test",
      "sent_at": "2001-01-02T10:30:00-05:00",
      "split": "dev",
      "arm": "clean",
      "pair_of": null,
      "focus_identity": [],
      "labels": {
        "reply_request_present": false,
        "non_reply_action_request_present": false,
        "sender_commitment_present": true,
        "action_deadline_present": true,
        "expressed_urgency": 0,
        "response_expectation": "none"
      },
      "ambiguity": false,
      "ambiguity_note": "",
      "label_source": "model_prelabel",
      "human_review_status": "unreviewed",
      "attribution": "recipient_group",
      "attack_location": null,
      "seed_id": "sender-promise"
    },
    {
      "case_id": "seed-recipient-request",
      "file": "corpus/seed-recipient-request.eml",
      "thread_root": "seed-commitment-root@example.test",
      "template_family": "seed-commitment",
      "mailbox": "dev-archive@example.test",
      "sent_at": "2001-01-02T10:30:00-05:00",
      "split": "dev",
      "arm": "clean",
      "pair_of": null,
      "focus_identity": [],
      "labels": {
        "reply_request_present": false,
        "non_reply_action_request_present": true,
        "sender_commitment_present": false,
        "action_deadline_present": true,
        "expressed_urgency": 0,
        "response_expectation": "non_reply_action_only"
      },
      "ambiguity": false,
      "ambiguity_note": "",
      "label_source": "model_prelabel",
      "human_review_status": "unreviewed",
      "attribution": "recipient_group",
      "attack_location": null,
      "seed_id": "recipient-request"
    },
    {
      "case_id": "seed-both",
      "file": "corpus/seed-both.eml",
      "thread_root": "seed-review-and-reply-root@example.test",
      "template_family": "seed-review-and-reply",
      "mailbox": "dev-archive@example.test",
      "sent_at": "2001-01-02T10:30:00-05:00",
      "split": "dev",
      "arm": "clean",
      "pair_of": null,
      "focus_identity": [],
      "labels": {
        "reply_request_present": true,
        "non_reply_action_request_present": true,
        "sender_commitment_present": false,
        "action_deadline_present": false,
        "expressed_urgency": 0,
        "response_expectation": "both"
      },
      "ambiguity": false,
      "ambiguity_note": "",
      "label_source": "model_prelabel",
      "human_review_status": "unreviewed",
      "attribution": "recipient_group",
      "attack_location": null,
      "seed_id": "both"
    },
    {
      "case_id": "seed-owner-alex",
      "file": "corpus/seed-owner-alex.eml",
      "thread_root": "seed-multi-recipient-root@example.test",
      "template_family": "seed-multi-recipient",
      "mailbox": "dev-archive@example.test",
      "sent_at": "2001-01-02T10:30:00-05:00",
      "split": "dev",
      "arm": "clean",
      "pair_of": null,
      "focus_identity": [
        "Alex"
      ],
      "labels": {
        "reply_request_present": false,
        "non_reply_action_request_present": true,
        "sender_commitment_present": false,
        "action_deadline_present": false,
        "expressed_urgency": 0,
        "response_expectation": "non_reply_action_only"
      },
      "ambiguity": false,
      "ambiguity_note": "",
      "label_source": "model_prelabel",
      "human_review_status": "unreviewed",
      "attribution": "to",
      "attack_location": null,
      "seed_id": "owner-alex"
    },
    {
      "case_id": "seed-owner-sam",
      "file": "corpus/seed-owner-sam.eml",
      "thread_root": "seed-multi-recipient-root@example.test",
      "template_family": "seed-multi-recipient",
      "mailbox": "dev-archive@example.test",
      "sent_at": "2001-01-02T10:30:00-05:00",
      "split": "dev",
      "arm": "clean",
      "pair_of": null,
      "focus_identity": [
        "Sam"
      ],
      "labels": {
        "reply_request_present": false,
        "non_reply_action_request_present": false,
        "sender_commitment_present": false,
        "action_deadline_present": false,
        "expressed_urgency": 0,
        "response_expectation": "none"
      },
      "ambiguity": false,
      "ambiguity_note": "",
      "label_source": "model_prelabel",
      "human_review_status": "unreviewed",
      "attribution": "to",
      "attack_location": null,
      "seed_id": "owner-sam"
    },
    {
      "case_id": "seed-done-quoted-request",
      "file": "corpus/seed-done-quoted-request.eml",
      "thread_root": "seed-resolved-reply-root@example.test",
      "template_family": "seed-resolved-reply",
      "mailbox": "dev-archive@example.test",
      "sent_at": "2001-01-02T10:30:00-05:00",
      "split": "dev",
      "arm": "clean",
      "pair_of": null,
      "focus_identity": [],
      "labels": {
        "reply_request_present": false,
        "non_reply_action_request_present": false,
        "sender_commitment_present": false,
        "action_deadline_present": false,
        "expressed_urgency": 0,
        "response_expectation": "none"
      },
      "ambiguity": false,
      "ambiguity_note": "",
      "label_source": "model_prelabel",
      "human_review_status": "unreviewed",
      "attribution": "recipient_group",
      "attack_location": null,
      "seed_id": "done-quoted-request"
    },
    {
      "case_id": "seed-ambiguous-no-parent",
      "file": "corpus/seed-ambiguous-no-parent.eml",
      "thread_root": "seed-elliptical-reply-root@example.test",
      "template_family": "seed-elliptical-reply",
      "mailbox": "dev-archive@example.test",
      "sent_at": "2001-01-02T10:30:00-05:00",
      "split": "dev",
      "arm": "missing_context",
      "pair_of": "seed-ambiguous-with-parent",
      "focus_identity": [],
      "labels": {
        "reply_request_present": null,